acn,synopsis,narrative,analysis_summary,overall_confidence,method,model,processing_time,AE100_Present,AE100_Confidence,AE100_Explanation,AE200_Present,AE200_Confidence,AE200_Explanation,AD000_Present,AD000_Confidence,AD000_Explanation,PE100_Present,PE100_Confidence,PE100_Explanation,PE200_Present,PE200_Confidence,PE200_Explanation,PP100_Present,PP100_Confidence,PP100_Explanation,PT100_Present,PT100_Confidence,PT100_Explanation,PC100_Present,PC100_Confidence,PC100_Explanation,PC300_Present,PC300_Confidence,PC300_Explanation,SC000_Present,SC000_Confidence,SC000_Explanation,SD000_Present,SD000_Confidence,SD000_Explanation,SI000_Present,SI000_Confidence,SI000_Explanation,SP000_Present,SP000_Confidence,SP000_Explanation,OC000_Present,OC000_Confidence,OC000_Explanation,OP000_Present,OP000_Confidence,OP000_Explanation,OR000_Present,OR000_Confidence,OR000_Explanation,OT000_Present,OT000_Confidence,OT000_Explanation,PC200_Present,PC200_Confidence,PC200_Explanation
1305704,CRP Controller observed an UAV aircraft that was assigned 3;000 feet descend into the vicinity of another aircraft under his control. Controller observes the UAV aircraft climb back up to 3;000. Traff,Aircraft Y radar identified and vectored for TAZ RWY31L NGP. Aircraft Z radar identified and vectored ASR RWY31L NGP. Aircraft X released Predator 2 Departure. Aircraft X radar identified and altitude verified. Aircraft X observed at 3000. Aircraft X observed and verified descending. Aircraft X repo,"The incident involved a UAV aircraft descending below its assigned altitude of 3,000 feet into the vicinity of another aircraft, which was promptly corrected. The event suggests potential skill-based errors and decision-making lapses at the operator/controller level, with no explicit evidence of violations. Environmental and technological factors appear nominal, but cognitive workload and team coordination may have contributed. Supervisory and organizational influences show no direct indications but cannot be fully excluded without further data. Physical state factors such as fatigue or stress are not explicitly mentioned but remain possible contributors given the operational context. Resource support issues are not evident from the narrative.",0.8,OPENAI + YAML + FewShot,gpt-4.1-mini,17.00325894355774,1,0.85,"The UAV descended below the assigned altitude, indicating a lapse in maintaining altitude control, a",1,0.8,The decision to descend below the assigned altitude into the vicinity of another aircraft reflects a,0,0.1,No evidence suggests intentional disregard of rules or procedures; the descent appears unintentional,0,0.2,"No mention of adverse weather, terrain, or workspace design issues affecting performance.",0,0.15,No reported equipment malfunctions or interface issues influencing the incident.,1,0.75,"The interaction between controllers and aircraft indicates some coordination challenges, as the UAV ",0,0.25,No explicit information on training deficiencies or inadequate preparation.,1,0.7,Potential cognitive workload or situational awareness challenges are inferred from the altitude devi,0,0.3,"No explicit evidence of fatigue, stress, or illness affecting performance, though cannot be fully ex",0,0.2,No direct indicators of organizational safety culture issues enabling unsafe practices.,0,0.15,No evidence of supervisors knowingly disregarding rules or instructions.,0,0.15,No clear signs of supervisory failures contributing to the incident.,0,0.15,No information suggesting inadequate planning or resource allocation at supervisory level.,0,0.1,No data indicating organizational climate or culture issues impacting safety.,0,0.1,No indication of deficient or inadequate policies or procedures affecting operations.,0,0.1,"No evidence of staffing shortages, equipment limitations, or budget constraints influencing the even",0,0.1,No information on training program deficiencies.,0,0.1,No data suggesting management decisions contributed to the incident.
1307339,Model aircraft pilot; who is also a private pilot; discovered that he has been operating his model aircraft 4 SM from SHD airport while believing he was outside 5 SM previously.,I discovered yesterday that I have been flying model aircraft 4.02 miles from Shenandoah Regional airport without first notifying them. I had previously measured the distance as over five miles but while listening to my scanner heard an aircraft on approach to runway five report four miles out while,"The incident involves a model aircraft pilot who miscalculated the distance from Shenandoah Regional airport, operating within 4.02 miles instead of the required 5 miles without prior notification. The pilot did not fly above 400 feet AGL nor in proximity to visible full-scale aircraft, indicating adherence to some safety norms. The error appears to stem from an initial measurement mistake and lack of verification procedures. No evidence suggests physical impairment or resource constraints. Organizational policies or training programs related to model aircraft operations and notification procedures may be insufficient or unclear, contributing to the regulatory breach. Supervisory and safety culture factors are not directly implicated given the pilot's proactive attitude toward compliance once the error was discovered.",0.9,OPENAI + YAML + FewShot,gpt-4.1-mini,13.398898839950562,1,0.9,"The pilot made a measurement error in determining the distance from the airport, indicating a lapse ",1,0.85,The pilot decided to operate within 5 miles without confirming the exact distance or notifying the a,1,0.9,"Operating within 5 miles of an airport without notification constitutes a regulatory violation, even",0,0.1,No adverse physical environmental factors such as weather or terrain were reported that could have c,0,0.1,No equipment malfunction or technological interface issues were indicated; the pilot used a phone GP,0,0.1,The operation was conducted solo with no team coordination factors involved.,1,0.8,The pilot's misjudgment suggests possible gaps in training regarding precise location verification a,0,0.1,"No evidence of fatigue, stress, or cognitive impairment was reported.",0,0.1,"No indications of physical impairment, illness, or fatigue affecting performance.",0,0.2,No direct evidence of an organizational safety culture issue; the pilot demonstrated concern for reg,0,0.1,No supervisory personnel or deviations were involved in this private operation.,0,0.1,No supervisory oversight was applicable or reported.,0,0.1,No evidence of planning failures at the supervisory level.,0,0.2,No organizational climate or culture factors were identified as contributing.,1,0.85,The incident suggests that policies or procedures regarding notification and distance verification f,0,0.1,"No resource constraints such as staffing, equipment, or budget limitations were reported or inferred",1,0.8,Potential deficiencies in training programs for model aircraft operators on regulatory compliance an,0,0.1,No management decisions were implicated in this incident.
1307833,A CyPhy PARC UAS pilot reported giving a demonstration flight beneath ORD Class B airspace up to 65 feet AGL without a transponder.,UAS operations in accordance with COA/333. Mode-c transponder (30 mile/Mode C veil) not required by 91.215 exemption due to operations in Class G airspace (Notification not required).,"The incident involved a CyPhy PARC UAS pilot conducting a demonstration flight beneath ORD Class B airspace at 65 feet AGL without a transponder. Operations complied with COA/333 and FAA 91.215 exemptions for Class G airspace, indicating regulatory adherence. No direct evidence of physical state impairments or resource constraints was found. However, potential skill-based errors and decision-making considerations exist due to low-altitude flight near controlled airspace without transponder use. Organizational policies and supervisory oversight appear adequate given compliance with exemptions, but latent cultural or procedural factors cannot be fully excluded.",0.8,OPENAI + YAML + FewShot,gpt-4.1-mini,18.89897656440735,1,0.85,The pilot conducted a low-altitude demonstration flight near controlled airspace without a transpond,1,0.8,"The decision to fly without a transponder under Class B airspace, even if legally exempted due to Cl",0,0.1,No violation is identified because the operation adhered to the COA/333 and FAA 91.215 exemption for,0,0.1,"No evidence of adverse physical environmental factors such as weather, terrain, or workspace design ",0,0.1,No technological malfunctions or interface issues were noted; the transponder exemption was regulato,0,0.1,No indication of team coordination problems; the incident involved a single pilot demonstration flig,0,0.1,No information suggests inadequate training conditions contributed to the incident.,0,0.1,"No signs of impaired cognitive state such as confusion, distraction, or overload were reported.",0,0.1,"No indications of fatigue, stress, illness, or physical impairment affecting the pilot were present.",0,0.1,Organizational safety culture appears adequate given adherence to COA and regulatory exemptions; no ,0,0.1,No evidence of supervisory personnel disregarding rules or instructions was found.,0,0.1,Supervision appears effective as operations complied with established COA and FAA regulations.,0,0.1,No ineffective planning was evident; flight was conducted under approved conditions.,0,0.1,No organizational climate or culture issues impacting safety were identified.,0,0.1,"Policies and procedures were followed, including COA and FAA exemptions; no deficiencies noted.",0,0.1,"No resource limitations such as staffing shortages, equipment constraints, or budget issues were rep",0,0.1,Training programs appear sufficient given regulatory compliance and pilot capability.,0,0.1,Management decisions supported compliant operations; no adverse decisions impacting safety were iden
1320928,A rated Private pilot reported flying his UAV in Corona Park; 2 NM south of LGA; with the Tower's permission.,I was test operating an Unmanned Aerial System (UAS); a DJI Phantom 3 Professional; within Flushing Meadows Corona Park in Queens; NY. This flight was purely for hobby/recreational purposes (non-commercial operation). It is legal to fly UAS in this park; however; since it is approximately 2 NM south,"The incident involved a rated private pilot conducting a recreational UAV flight near LGA with prior coordination with ATC. No direct evidence of skill-based errors, decision-making errors, or violations was found. The pilot complied with ATC requests and operated within legal boundaries. There is no indication of physical state impairments or technological failures. Organizational and supervisory factors appear minimal given the recreational nature and self-coordination. However, some minor concerns about policy clarity and resource support for recreational UAV operations near controlled airspace may exist.",0.9,OPENAI + YAML + FewShot,gpt-4.1-mini,15.650157928466797,0,0.9,No evidence of pilot error in UAV control or operation was reported. The pilot followed ATC instruct,0,0.9,The pilot made appropriate decisions including notifying ATC prior to flight and responding promptly,0,0.95,No violations of regulations or instructions were identified. The pilot operated within legal limits,0,0.9,No adverse physical environmental factors such as weather or terrain issues were reported that could,0,0.9,No technological malfunctions or interface issues with the DJI Phantom 3 Professional were reported.,0,0.9,"As a single operator recreational flight, no team coordination issues were present.",0,0.9,No information suggests inadequate training conditions or deficiencies affecting performance.,0,0.9,"No signs of cognitive impairment, confusion, or workload issues were evident from the narrative.",0,0.95,"No indications of fatigue, stress, illness, or physical impairment affecting the pilot were reported",0,0.9,No organizational safety culture issues were identified given the recreational nature and self-direc,0,0.9,No supervisory personnel involvement or deviations were applicable in this recreational context.,0,0.9,No evidence of ineffective supervision was present as the pilot operated independently.,0,0.9,No ineffective planning or scheduling issues were apparent.,0,0.9,No broader organizational climate or culture factors were relevant to this incident.,1,0.85,Some ambiguity exists regarding policies and procedures for recreational UAV flights near controlled,1,0.8,"Limited resource support for recreational UAV operators near controlled airspace may exist, such as ",0,0.9,No evidence suggests deficiencies in training programs affecting this incident.,0,0.9,No management decisions impacting this incident were identified.
1330573,An Unmanned Aircraft System (UAS) pilot reported his aircraft and a law enforcement helicopter had a near miss at 550 feet even though his UAS computerized flight plan's altitude restriction was 400 f,I was flying an unmanned aircraft which has an autopilot which was programmed to fly a grid pattern nearby within Visual Line of Site (VLOS). I was monitoring the flight when a helicopter appeared in the area. I took action by triggering the autopilot's RTL (Return to Launch location). The aircraft ,"The incident involved a near miss between a UAS and a law enforcement helicopter at 550 feet, exceeding the UAS autopilot's programmed altitude restriction of 400 feet. The UAS pilot engaged the autopilot's Return to Launch (RTL) mode, but the aircraft maintained cruise altitude during the landing sequence, contributing to the altitude conflict. No evidence suggests physical impairment or fatigue of the pilot. The incident highlights potential technological environment issues with autopilot altitude management and possible team coordination gaps between UAS and manned aircraft operators. Organizational policies and resource support factors may also have contributed, given the altitude restriction was not effectively enforced or communicated. Supervisory and safety culture factors appear less evident but cannot be fully excluded without further data.",0.8,OPENAI + YAML + FewShot,gpt-4.1-mini,19.79593515396118,0,0.3,No direct evidence of pilot skill-based errors such as control input mistakes; the pilot engaged RTL,1,0.85,"The pilot's decision to rely on the autopilot's programmed altitude restriction was insufficient, as",0,0.2,No indication that the pilot knowingly violated altitude restrictions or operational rules; the auto,0,0.2,"No adverse weather, terrain, or workspace design issues reported that would affect performance.",1,0.9,The autopilot system maintained cruise altitude during the landing sequence instead of descending be,1,0.8,The near miss suggests insufficient coordination or communication between the UAS pilot and the mann,0,0.3,No evidence that training deficiencies contributed; pilot demonstrated awareness and appropriate use,0,0.3,No signs of impaired cognitive state such as confusion or distraction; pilot actively monitored and ,0,0.1,"No indications of fatigue, stress, illness, or workload issues affecting the pilot's physical state.",0,0.3,No explicit evidence of organizational safety culture issues enabling unsafe practices in this incid,0,0.2,No data indicating supervisors knowingly disregarded rules or instructions.,0,0.3,No clear evidence of supervisory failures contributing directly to the incident.,0,0.3,No direct evidence that supervisory planning deficiencies caused the event.,0,0.3,No explicit information on overall organizational climate or culture impacting safety performance.,1,0.85,The altitude restriction of 400 feet was not effectively enforced or integrated with the autopilot's,1,0.75,Potential limitations in equipment capability (autopilot altitude management) and possibly insuffici,0,0.3,No evidence that training programs were inadequate or contributed to the incident.,0,0.3,No direct evidence that management decisions influenced this incident.
1335915,A commercial UAS Operator was granted permission from local ATC to fly 3.5 miles from the Class C airport; but later questioned whether a Section 333 Letter of Agreement and Certificate of Authorizati,I am a current private pilot SEL and commercial UAV (i.e. drone) pilot with Section 333 waiver and blanket COA (Certificate of Authority). I believed that my COA restricted me from flying within 5 miles of a towered airport without either authorization from the local ATC (i.e. tower) OR an amended C,"The incident involves a commercial UAV operator who believed they were compliant with Section 333 waiver and COA requirements when operating within 3.5 miles of a towered airport after obtaining local ATC permission. The analysis identifies decision-making errors related to regulatory interpretation, potential violations due to ambiguous understanding of authorization requirements, and organizational policy and supervisory shortcomings that may have contributed to confusion. Physical state factors such as fatigue or stress are not evident. Resource support issues such as staffing or equipment limitations are not directly implicated but organizational policies and training programs may lack clarity or adequacy regarding operations near controlled airspace.",0.9,OPENAI + YAML + FewShot,gpt-4.1-mini,19.742398977279663,0,0.2,No direct evidence of pilot skill-based errors such as control input mistakes or manual handling err,1,0.9,The operator demonstrated a decision-making error by misinterpreting the regulatory requirements for,1,0.85,Potential violation is present due to ambiguity in adherence to Section 333 waiver and COA condition,0,0.1,No adverse physical environmental factors such as weather or terrain impacting performance are indic,0,0.1,No equipment malfunctions or automation issues are reported that would affect the operation.,0,0.2,No evidence of coordination failures among team members or between pilot and ATC beyond normal commu,1,0.8,Training conditions may be inadequate regarding regulatory interpretation and operational procedures,0,0.1,No signs of impaired cognitive state such as confusion or distraction are noted.,0,0.1,"No indications of fatigue, stress, illness, or workload issues affecting the operator's physical sta",1,0.85,Organizational safety culture may be deficient in emphasizing clear understanding and communication ,0,0.3,No direct evidence that supervisors knowingly disregarded rules or instructions.,1,0.8,Supervisory oversight appears ineffective in ensuring clear guidance and enforcement of operational ,1,0.8,Planning deficiencies are evident in the lack of clear procedures or amendments to COA for operation,1,0.85,The broader organizational climate may lack emphasis on rigorous regulatory compliance and proactive,1,0.9,Policies and procedures appear insufficiently detailed or communicated regarding operations near tow,0,0.2,No explicit evidence of resource constraints such as staffing shortages or equipment limitations imp,1,0.85,Training programs may not adequately cover regulatory nuances and operational requirements for contr,1,0.8,Management decisions may have contributed to insufficient policy development and training emphasis o
1347459,ZLA controllers reported a UAV that could not accept holding instructions and was not allowed in restricted airspace. One Controller was confused and had busy airspace. The MOS did not have any specia,I was handed paperwork from my supervisor while on position. The paperwork provided a brief description of what to expect from a flight that was to fly through my airspace (Aircraft X). The paperwork said Aircraft X would orbit in NTTR for 2+00 hrs. When the aircraft checked on; he asked to proceed ,"The incident involved a UAV entering restricted airspace due to controller confusion and workload issues. The controller initially approved a holding pattern believing it was pre-coordinated, but later realized it violated airspace restrictions. The busy sector workload and unclear management guidance contributed to the error. There is evidence of decision-making errors, team coordination issues, cognitive overload, and inadequate supervisory and organizational support. Physical state factors such as stress and workload likely affected controller performance. Resource support issues such as management communication and staffing may have contributed.",0.9,OPENAI + YAML + FewShot,gpt-4.1-mini,26.247663497924805,1,0.85,"The controller initially approved the holding pattern without verifying airspace restrictions, indic",1,0.9,The decision to allow the UAV to proceed into restricted airspace was based on incorrect assumptions,0,0.2,No clear evidence of intentional rule-breaking or deliberate disregard for procedures was found; the,0,0.1,No specific adverse physical environmental factors such as weather or workspace design were mentione,0,0.1,No equipment malfunctions or interface issues were reported that contributed to the incident.,1,0.85,Confusion among controllers and lack of clear communication about the UAV's clearance indicate team ,0,0.2,No direct evidence of inadequate training conditions was provided.,1,0.9,"The controller experienced confusion and high workload, impairing situational awareness and cognitiv",1,0.8,"The controller was busy managing a busy sector and handling paperwork simultaneously, suggesting str",0,0.3,No explicit indications of a deficient safety culture were noted in the narrative.,0,0.3,No evidence that supervisors knowingly disregarded rules or instructions.,1,0.85,"Supervisory guidance was unclear or delayed, as the controller sought management input without timel",1,0.8,Lack of clear pre-coordination and planning for UAV operations in restricted airspace contributed to,0,0.3,No direct evidence of organizational climate or culture issues affecting safety was presented.,1,0.85,Existing policies or procedures appear insufficient or inadequately communicated regarding UAV opera,1,0.85,"Management support and communication were lacking during the incident, and staffing or workload dist",0,0.2,No information suggests deficiencies in training programs related to this incident.,1,0.85,"Management decisions regarding UAV airspace coordination and controller support were insufficient, c"
1347720,Commercial Drone Operator reported having conducted a photo shoot job using a company-owned drone within 500 feet of personnel on the ground which is a violation of their authorization to film during ,I have a PPL and also hold a Section 333 Exemption for commercial UAV operations. This violation occurred when I was filming a commercial for a private golf course with my UAV. I reported this flight to local airports and filed a NOTAM as required. However; during filming for this commercial I was l,"The incident involves a commercial drone operator violating the terms of their Section 333 Exemption by flying within 500 feet of people without proper authorization and lacking the required Motion Picture and Television Operations Manual (MPTOM). The violation was deliberate but conducted safely with verbal consent from those filmed. Contributing factors include decision-making errors, violations of regulations, possible gaps in training and organizational policies, and inadequate resource support related to operational guidance and documentation. No evidence suggests physical state impairments or technological failures.",0.9,OPENAI + YAML + FewShot,gpt-4.1-mini,17.749388456344604,1,0.8,"The operator flew the UAV within prohibited proximity to people, indicating a lapse in precise contr",1,0.9,The operator knowingly conducted flights closer than authorized distances and without the required M,1,1.0,The flight within 500 feet of people without proper authorization and lacking the MPTOM constitutes ,0,0.1,No evidence indicates adverse physical environmental factors such as weather or terrain affected per,0,0.1,No reported equipment malfunctions or interface issues contributed to the incident.,0,0.2,The operator acted independently; no team coordination issues were reported.,1,0.75,"The operator discovered only after the incident the need for an MPTOM, indicating insufficient train",0,0.2,"No indications of fatigue, stress, or cognitive overload were reported.",0,0.1,"No evidence of fatigue, illness, or physical impairment affecting performance.",1,0.8,The organizational culture may have implicitly tolerated or insufficiently emphasized strict adheren,0,0.2,No direct evidence that supervisors knowingly disregarded rules or instructions.,1,0.85,"Supervisory oversight appears insufficient, failing to ensure operator compliance with all regulator",1,0.8,Operational planning did not adequately address regulatory compliance or ensure the operator had all,1,0.75,The broader organizational climate may lack rigorous enforcement or communication of safety and regu,1,0.9,"Existing policies and procedures appear inadequate or poorly communicated, as the operator was unawa",1,0.85,"Resource support deficiencies likely exist, including insufficient training materials, documentation",1,0.8,Training programs may not comprehensively cover all regulatory requirements and operational constrai,0,0.3,No direct evidence of management decisions contributing to the incident was found.
