acn,synopsis,narrative,analysis_summary,overall_confidence,method,model,processing_time,AE100_Present,AE100_Confidence,AE100_Explanation,AE200_Present,AE200_Confidence,AE200_Explanation,AD000_Present,AD000_Confidence,AD000_Explanation,PE100_Present,PE100_Confidence,PE100_Explanation,PE200_Present,PE200_Confidence,PE200_Explanation,PP100_Present,PP100_Confidence,PP100_Explanation,PT100_Present,PT100_Confidence,PT100_Explanation,PC100_Present,PC100_Confidence,PC100_Explanation,PC300_Present,PC300_Confidence,PC300_Explanation,SC000_Present,SC000_Confidence,SC000_Explanation,SD000_Present,SD000_Confidence,SD000_Explanation,SI000_Present,SI000_Confidence,SI000_Explanation,SP000_Present,SP000_Confidence,SP000_Explanation,OC000_Present,OC000_Confidence,OC000_Explanation,OP000_Present,OP000_Confidence,OP000_Explanation,OR000_Present,OR000_Confidence,OR000_Explanation,OT000_Present,OT000_Confidence,OT000_Explanation,PC200_Present,PC200_Confidence,PC200_Explanation
1636949,UAV operator reported a possible airspace incursion occurred in the vicinity of PXR.,The purpose of this report is to report a LAANC portal that is not operating properly which contributed to a possible airspace incursion by our UAS.At location  Number 1 (030- degrees at 2.0 NM from PXR VOR); the PIC requested a LAANC airspace waiver through the AIRMAP program. On the 'Flight Briefi,"The incident involved a possible airspace incursion linked to malfunctioning LAANC portal software (AIRMAP program) that misled the PIC into believing the flight authorization was granted. The UAV operator submitted flight plans that appeared successful but lacked proper authorization confirmation, leading to potential unauthorized airspace entry. Contributing factors include technological environment failures, cognitive state impacts due to misleading system feedback, and organizational policy/procedure inadequacies regarding LAANC system reliability and contingency handling. No direct evidence of physical state impairments or supervisory violations was found, but resource support limitations may have influenced system maintenance and training adequacy.",0.88,OPENAI + YAML + FewShot,gpt-4.1-mini,13.952352285385132,0,0.3,No direct evidence that the UAV operator made a manual control error or lacked basic flying skills; ,1,0.85,The PIC proceeded with flight operations based on misleading system feedback indicating successful a,0,0.2,No indication that the operator knowingly violated rules; the operator believed authorization was gr,0,0.2,No adverse physical environmental factors such as weather or terrain were reported affecting perform,1,0.95,"The AIRMAP program malfunctioned by displaying ambiguous authorization status messages, directly con",0,0.3,No evidence of coordination failures among team members or between operator and supervisors.,1,0.75,Potential inadequacies in training regarding contingency handling for LAANC system failures or ambig,1,0.9,"The operator’s situational awareness was likely impaired by ambiguous system feedback, causing confu",0,0.2,"No information suggesting fatigue, stress, illness, or workload issues affecting the operator’s phys",0,0.3,No explicit evidence of an organizational safety culture that tolerates unsafe practices was found.,0,0.2,No indication that supervisors knowingly disregarded rules or instructions.,0,0.3,No direct evidence of supervision failures during the incident.,1,0.8,Organizational planning may have been insufficient regarding system reliability assurance and contin,0,0.3,No clear evidence of organizational climate or culture issues affecting safety performance.,1,0.85,Policies and procedures appear insufficient to address LAANC system malfunctions and to guide operat,1,0.8,"Possible resource constraints may have limited system maintenance, software reliability, and operato",0,0.4,"No direct evidence of inadequate training programs, but potential gaps exist related to LAANC failur",0,0.3,No explicit management decisions contributing to the incident were identified.
1637257,UAV ground commander reported the drone flying erratically after takeoff.,After all pre-flight checks and protocols were executed; the aircraft took off. Shortly after takeoff (~1.5 seconds); the aircraft was observed as acting in a strange manner (non-commanded oscillations and yaw movements). The Pilot in Command (PIC) reacted to the problem immediately and began the se,"The UAV experienced uncommanded oscillations and yaw movements shortly after takeoff, indicating possible technological malfunction or control interface issues. The PIC responded promptly by initiating recovery and landing procedures, demonstrating appropriate decision-making under stress. No evidence suggests physical impairment or violations. Potential contributing factors include technological environment issues and cognitive workload. Organizational and supervisory factors appear less evident but cannot be fully excluded without further data.",0.9,OPENAI + YAML + FewShot,gpt-4.1-mini,11.39442491531372,0,0.2,No evidence indicates pilot skill errors; the PIC reacted promptly and correctly to regain control a,0,0.3,"The PIC made appropriate decisions under pressure, including initiating immediate landing when contr",0,0.1,No indications of rule violations or deliberate disregard of procedures were reported.,0,0.2,No adverse physical environmental factors such as weather or terrain issues were mentioned affecting,1,0.95,Strong evidence of technological environment issues is present due to uncommanded oscillations and y,0,0.2,No indications of team coordination problems; the ground commander and PIC actions appear coordinate,0,0.3,No information suggests inadequate training conditions contributed to the incident.,1,0.85,"The PIC experienced high cognitive workload managing unexpected UAV behavior, which could affect sit",0,0.1,"No evidence of fatigue, stress, illness, or physical impairment affecting the PIC was reported.",0,0.2,No data suggests organizational safety culture issues contributed to the incident.,0,0.2,No supervisory personnel deviations or disregard for rules were identified.,0,0.2,Supervision appears effective given adherence to protocols and timely PIC response.,0,0.2,No evidence of inadequate planning or risk assessment contributing to the event.,0,0.2,Organizational climate and culture factors are not indicated as contributing factors.,0,0.2,Existing policies and procedures appear to have been followed; no deficiencies reported.,0,0.3,"No explicit evidence of resource limitations such as staffing shortages, equipment inadequacies, or ",0,0.2,No indication that training programs were insufficient or contributed to the incident.,0,0.2,No management decisions were identified as contributing factors.
1638145,UAV ground crew reported a NMAC with low flying aircraft that was not flying the airport traffic pattern.,The UAS Company has ZZZ's permission to conduct UAS Operators out of ZZZ Airport. Our operations are always South of Runway XX/ XY and at or below 400 feet AGL to comply with Part  XX7 Regulations. We were conducting UAS Training out of ZZZ. We were in the air in cruise flight just south of Runway X,"The incident involved a near mid-air collision (NMAC) between a UAV conducting authorized training operations and a low-flying manned aircraft performing an unauthorized low pass and abrupt maneuver near the UAV operating area. Contributing factors include pilot decision errors and violations by the manned aircraft pilot, environmental and operational constraints affecting situational awareness, and potential organizational and supervisory shortcomings in managing airspace and communication protocols. No direct evidence of physical state impairments or resource support limitations was found, but some latent organizational influences may have indirectly contributed.",0.9,OPENAI + YAML + FewShot,gpt-4.1-mini,10.99632740020752,1,0.85,The manned aircraft pilot performed an extremely low pass at near maximum speed and made an abrupt l,1,0.9,The pilot's decision to deviate from the runway heading and conduct a low pass outside the normal tr,1,0.9,The manned aircraft pilot violated standard traffic pattern procedures and possibly regulatory altit,1,0.8,"The incident occurred mid-afternoon with normal weather conditions implied; however, the proximity t",0,0.2,No direct evidence of technological failures or interface issues affecting UAV or manned aircraft op,1,0.85,"The UAV ground crew attempted to direct the UAV to avoid conflict, indicating some coordination effo",1,0.75,"The UAV was conducting training operations, which may introduce variability in operator proficiency ",1,0.8,"The UAV operators and ground crew were likely maintaining situational awareness, but the unexpected ",0,0.1,"No indications of fatigue, stress, illness, or physical impairment affecting UAV operators or manned",1,0.8,The occurrence of unauthorized low passes and insufficient coordination suggests possible organizati,0,0.3,No explicit evidence that supervisors knowingly disregarded rules or instructions was found.,1,0.85,Supervisory oversight may have been inadequate in enforcing airspace usage and ensuring safe separat,1,0.8,"Planning for mixed UAV and manned aircraft operations at the airport may have been insufficient, lac",1,0.75,Organizational climate may tolerate or insufficiently discourage deviations from standard operating ,1,0.85,Existing policies and procedures may be inadequate or poorly enforced regarding airspace management ,0,0.2,"No evidence of staffing shortages, equipment limitations, or budget constraints impacting this incid",1,0.7,Training programs for UAV operators appear active but may lack emphasis on integrated operations wit,1,0.75,"Management decisions regarding operational boundaries, communication protocols, and risk mitigation "
1638195,DJI UAV operator reported an inadvertent intrusion into ALB Class C airspace.,During a sUAS flight with my Mavic 2 Pro; I accidentally flew in to the edge of ALB's class C airspace. Having recently switched to a new aircraft and flight controls; my typical pre-flight tooling was not available on the new platform and lack of familiarity with the platform and incorrect memory o,"The incident involved a DJI UAV operator inadvertently entering ALB Class C airspace due to unfamiliarity with a new aircraft and flight controls, incorrect memory of local airspace boundaries, and inadequate technological support from the new controller. Contributing factors include skill-based errors, decision-making errors, technological environment limitations, cognitive state issues, and organizational resource support deficiencies. No evidence of physical state impairments or supervisory violations was found.",0.9,OPENAI + YAML + FewShot,gpt-4.1-mini,10.61052632331848,1,0.9,"The operator's unfamiliarity with the new aircraft and flight controls, combined with incorrect memo",1,0.9,The decision to proceed with the flight without fully verifying the new platform's tooling and airsp,0,0.1,There is no explicit evidence of intentional rule-breaking or deliberate disregard for regulations; ,0,0.1,"No mention of adverse weather, terrain, or workspace design issues affecting performance.",1,0.95,The new DJI Smart Controller lacked familiar warning formats and did not integrate with AirMap or LA,0,0.1,No evidence of coordination failures among team members; the operator appears to have flown solo.,1,0.85,The operator's lack of familiarity with the new platform and absence of typical pre-flight tooling s,1,0.9,Incorrect memory of local boundaries and unfamiliarity with new controller warnings indicate cogniti,0,0.1,"No indications of fatigue, stress, illness, or physical impairment were reported.",0,0.2,No direct evidence of organizational safety culture issues enabling unsafe practices.,0,0.1,No supervisory personnel involvement or deviations identified.,0,0.1,No evidence of ineffective supervision contributing to the incident.,0,0.1,No indication of ineffective supervisory planning affecting the flight.,0,0.1,No information suggesting organizational climate or culture issues.,0,0.2,No explicit mention of deficient policies or procedures affecting the operation.,1,0.9,The lack of integration of the new controller with critical airspace awareness tools and absence of ,1,0.85,The operator's unfamiliarity with the new platform and tooling suggests that training programs may n,0,0.2,No direct evidence of management decisions impacting this incident.
1638865,DJI Phantom UAV operator reported inadvertently operating in PIT Class B airspace without clearance.,Arrived at the loss location and was in a hurry to get out of the extreme cold temperatures. Did not adequately check airspace at the location and flew without prior authorization. Airspace violation was discovered in my company's monthly flight reviews and has been discussed with me for corrective ,"The UAV operator inadvertently flew in Class B airspace without clearance due to hurried conditions and inadequate airspace checks. Contributing factors include physical state stress from extreme cold, insufficient procedural adherence, and organizational oversight in training and resource support. No direct technological failures were reported, but cognitive lapses and supervisory safety culture issues are evident.",0.9,OPENAI + YAML + FewShot,gpt-4.1-mini,14.690909385681152,1,0.9,"The operator failed to adequately check airspace before flight, indicating a lapse in routine operat",1,0.9,The decision to launch quickly in extreme cold without proper clearance or airspace verification ref,1,0.95,Flying in Class B airspace without authorization constitutes a regulatory violation.,1,0.85,Extreme cold temperatures contributed to operator haste and impaired thorough pre-flight checks.,0,0.1,No evidence of equipment malfunction or interface issues was reported.,0,0.1,No indication of team coordination problems; the operator acted individually.,1,0.8,The operator's failure suggests possible gaps in training regarding airspace authorization and emerg,1,0.85,Stress and urgency likely degraded cognitive processing and situational awareness.,1,0.9,Exposure to extreme cold and urgency likely caused physical discomfort and stress impacting performa,1,0.8,The incident being discovered only during monthly reviews suggests a reactive rather than proactive ,0,0.2,No direct evidence that supervisors knowingly disregarded rules.,1,0.85,"Supervisory oversight failed to prevent unauthorized airspace entry, indicating ineffective supervis",0,0.3,No clear evidence of planning failures beyond supervision.,1,0.75,Organizational atmosphere may tolerate or insufficiently emphasize strict airspace compliance.,1,0.85,Policies requiring flight plans and airspace clearance exist but may lack enforcement or clarity.,1,0.8,Potential limitations in staffing or procedural support for timely flight planning and authorization,1,0.8,Training programs may inadequately prepare operators for airspace authorization requirements and str,0,0.3,No direct evidence of management decisions contributing to this incident.
1644296,UAV operator reported inadvertantly penetrating airspace without required ATC communication.,Fired up drone and flew low in a parking lot area; below the tree line; for about one minute not exceeding 30 ft. or so before realizing drone was just inside the 5 nm ring for ATC contact. Landed immediately and powered down. Filed this report soon after.,"The UAV operator inadvertently penetrated controlled airspace without required ATC communication while flying low in a parking lot area. The incident appears to involve skill-based and decision-making errors, with a possible violation of airspace rules. There is no direct evidence of physical state impairments or resource support issues, but organizational policies and supervisory oversight may have contributed to the event.",0.9,OPENAI + YAML + FewShot,gpt-4.1-mini,12.566357135772703,1,0.9,The operator flew the UAV low in a parking lot and failed to maintain awareness of the airspace boun,1,0.9,The decision to fly close to controlled airspace without confirming ATC communication requirements r,1,0.95,Penetrating controlled airspace without required ATC communication constitutes a regulatory violatio,0,0.3,No evidence of adverse physical environmental conditions such as weather or terrain affecting perfor,0,0.2,No indication of equipment malfunction or interface issues contributing to the incident.,0,0.2,The operation appears to be conducted by a single operator with no reported team coordination issues,0,0.3,"No direct evidence that training conditions contributed to the error; however, this cannot be fully ",0,0.3,"No explicit mention of fatigue, stress, or cognitive overload affecting the operator.",0,0.2,"No signs of fatigue, illness, or physical impairment were reported.",0,0.3,"No direct evidence of an unsafe safety culture enabling the violation, though organizational culture",0,0.2,No indication that supervisors knowingly disregarded rules or instructions.,0,0.2,No clear evidence of supervisory failures contributing to the incident.,0,0.2,No information suggesting inadequate planning or risk assessment.,0,0.3,No explicit evidence of organizational climate issues affecting safety performance.,1,0.85,The incident suggests possible gaps or inadequacies in policies or procedures regarding airspace bou,0,0.2,"No reported staffing shortages, equipment limitations, or budget constraints impacting the operation",0,0.3,"No direct evidence that training programs were insufficient, though this remains a potential contrib",0,0.3,No specific management decisions were identified as contributing factors.
1648559,ATC Controller reported an example why this particular airspace needs possible redesign and a UAS that was violating the airspace.,While working Local Control; I was already working a moderate amount of traffic with high complexity when a large UAS was observed and commented on by the Ground Controller. What appeared to be a larger quad-copter of large enough size to deliver packages operating a guesstimated 1 to 1.5 NM SE Palo,"The incident involved a large UAS operating in controlled airspace near Palo Alto, causing air traffic control (ATC) complexity and safety concerns. The denial of airspace extensions by Moffett without clear operational justification contributed to increased workload and constrained traffic management options. The presence of the UAS in unauthorized airspace, combined with ATC workload and coordination challenges, indicates multiple latent and active failures across HFACS levels, including organizational resource limitations and supervisory oversight issues.",0.9,OPENAI + YAML + FewShot,gpt-4.1-mini,12.28901720046997,0,0.2,No direct evidence of pilot or controller skill-based errors; the issue was more systemic and proced,0,0.3,No clear indication that individual decision-making errors by controllers or UAV operators caused th,1,0.85,"The UAV violated controlled airspace boundaries, operating at approximately 1 to 1.5 NM SE Palo Alto",0,0.3,No adverse weather or terrain factors were reported affecting performance; physical environment impa,0,0.2,No reported equipment malfunctions or automation issues affecting the incident; technological enviro,1,0.8,Coordination challenges were evident as the Ground Controller and Local Control had to manage UAS pr,0,0.3,"No explicit mention of training deficiencies; however, the complexity of managing UAS in controlled ",1,0.85,"High workload and traffic complexity increased cognitive demands on controllers, potentially impacti",1,0.9,"Controller workload was high due to traffic complexity and denied airspace extensions, likely causin",1,0.8,The organizational tolerance or lack of proactive measures regarding UAS operations in controlled ai,0,0.3,No evidence that supervisors knowingly disregarded rules or instructions; denials of airspace extens,1,0.85,Supervisory oversight failed to adequately address UAS incursions and denied airspace extension requ,1,0.8,"Airspace design and operational planning did not account for emerging UAS traffic, leading to constr",1,0.8,"Organizational climate appears reactive rather than proactive in managing UAS integration, reflectin",1,0.85,Existing policies and procedures did not effectively manage UAS operations or provide clear guidance,1,0.9,Resource limitations are implied by denied airspace extensions and inability to manage increased tra,0,0.3,"No direct evidence of inadequate training programs, though evolving UAS operational demands may requ",1,0.85,"Management decisions, including denial of airspace extensions without clear operational need, contri"
1652001,UAV operator reported miscommunication with ATC while drone was inflight.,Upon departing from Delta airspace; Tower switched Aircraft X over to Departure. Upon climbing; Departure advised Aircraft X to climb and maintain 10;000 feet. Shortly after Aircraft X was instructed to climb up to FL190; Aircraft X then read back the altitude of FL190. It was understood that Aircra,"The incident involved miscommunication between the UAV operator and ATC during multiple handoffs and altitude clearances, resulting in confusion about assigned flight levels. The UAV operator correctly programmed and cross-checked the autopilot settings, but conflicting altitude instructions and readbacks suggest possible cognitive and communication challenges. No direct evidence of physical impairment or resource constraints was found, but the complexity of remote operations and ATC coordination may have contributed to increased workload and stress.",0.88,OPENAI + YAML + FewShot,gpt-4.1-mini,10.457380771636965,0,0.2,No direct evidence that the UAV operator made a skill-based error; autopilot was correctly programme,0,0.3,No clear indication of poor decision-making by the operator; altitude changes followed ATC instructi,0,0.1,No indication that the operator knowingly violated procedures or regulations.,0,0.1,No mention of adverse physical environmental factors such as weather or workspace design affecting p,0,0.2,No reported equipment malfunctions or interface issues; autopilot functioned as expected.,1,0.9,"High confidence that miscommunication between UAV operator and multiple ATC sectors (Tower, Departur",0,0.3,"No explicit evidence that training deficiencies contributed, though complex ATC handoffs may require",1,0.85,Operator likely experienced increased cognitive workload and possible stress due to conflicting alti,0,0.1,"No evidence of fatigue, illness, or physical impairment affecting operator performance.",0,0.2,No direct evidence of organizational safety culture issues influencing this incident.,0,0.1,No indication that supervisors knowingly disregarded rules or instructions.,0,0.2,No clear evidence of supervisory failures contributing to the incident.,0,0.2,No indication of inadequate planning or risk assessment at supervisory level.,0,0.2,No evidence that overall organizational climate or culture negatively impacted safety performance he,0,0.3,No indication that policies or procedures were inadequate or contributed to the miscommunication.,0,0.2,"No evidence of staffing shortages, equipment limitations, or budget constraints affecting operations",0,0.3,"No direct evidence that training programs were insufficient, though complexity suggests potential be",0,0.2,No evidence that management decisions contributed to this incident.
